titulo,fuente,fecha,enlace
Trump tariffs should be reworked but not withdrawn: Veteran economist,Yahoo Finance,1 hour ago,https://finance.yahoo.com/news/trump-tariffs-should-be-reworked-but-not-withdrawn-veteran-economist-131916819.html
Magnificent 7 tariff-fueled losses top $2 trillion,Yahoo Finance,18 hours ago,https://finance.yahoo.com/news/magnificent-7-tariff-fueled-losses-top-2-trillion-125402148.html
"Cathie Wood's ARK Loads Up on NVIDIA, Sells Off Millions in UiPath Shares",GuruFocus.com,3 minutes ago,https://finance.yahoo.com/news/cathie-woods-ark-loads-nvidia-150717660.html
"Google Cloud News: Ironwood Processor, AI Gemini Models, Global Network",Investor's Business Daily,47 minutes ago,https://finance.yahoo.com/m/4850de5b-3c86-36fe-87c2-af680ada879c/google-cloud-news-ironwood.html
Nvidia Stock Gains as Tariffs Take Effect. Cathie Wood Is Scooping Up Shares.,Barrons.com,48 minutes ago,https://finance.yahoo.com/m/5a80a81f-265c-3162-a8d3-e0b6de38492c/nvidia-stock-gains-as-tariffs.html
NVIDIA (NVDA) Gets Tariff Exemption – But Jim Cramer Still Sees Order Declines Ahead,Insider Monkey,50 minutes ago,https://finance.yahoo.com/news/nvidia-nvda-gets-tariff-exemption-142055354.html
Here's 1 Nasdaq ETF to Consider Even as the Index Enters Into a Bear Market,Motley Fool,1 hour ago,https://finance.yahoo.com/news/heres-1-nasdaq-etf-consider-135400125.html
"These Stocks Are Moving the Most Today: Walmart, Pfizer, Apple, Tesla, Delta, Peabody Energy, Nvidia, Ford, and More",Barrons.com,1 hour ago,https://finance.yahoo.com/m/f96365e4-d84d-3da8-aa1b-37b0136e234e/these-stocks-are-moving-the.html
Tesla Underdelivers,Motley Fool,1 hour ago,https://finance.yahoo.com/news/tesla-underdelivers-134600733.html
Cathie Wood Doubled Down On This China Stock Prior To Trump Tariffs Taking Effect,Investor's Business Daily,1 hour ago,https://finance.yahoo.com/m/972eefb0-74ca-3e68-b938-741e2b68248d/cathie-wood-doubled-down-on.html
